{
  "schemaVersion": "rigor.routing-plan.v1",
  "artifactId": "routing-plan_EVAL-FEAT-2_1",
  "createdAt": "2023-11-14T22:13:34.000Z",
  "taskId": "EVAL-FEAT-2",
  "preflightArtifactId": "preflight_EVAL-FEAT-2",
  "preflightHash": "0000000000000000000000000000000000000000000000000000000000000000",
  "routingInputHash": "0000000000000000000000000000000000000000000000000000000000000000",
  "modelProfilesHash": "0000000000000000000000000000000000000000000000000000000000000000",
  "contractArtifactId": "contract_EVAL-FEAT-2",
  "contractHash": "0000000000000000000000000000000000000000000000000000000000000000",
  "policyHash": "0000000000000000000000000000000000000000000000000000000000000000",
  "plannedHead": null,
  "purpose": "implementation",
  "requiredCapabilityClass": "frontier",
  "eligibleCandidates": ["claude-frontier"],
  "excludedCandidates": [],
  "selection": {
    "candidateId": "claude-frontier",
    "provider": "synthetic",
    "model": "synthetic-frontier",
    "capabilityClass": "frontier",
    "relativeCost": 80
  },
  "controls": {
    "externalTransmission": "allowed",
    "requireHumanApproval": false,
    "requireIndependentReview": false
  },
  "budget": {
    "maxAttempts": 4,
    "maxDurationMs": 3600000,
    "maxRelativeCost": 100
  },
  "assessment": {
    "inputSchemaVersion": "rigor.routing-input.v2",
    "confidence": "high",
    "evidenceCount": 1
  },
  "status": "planned"
}
